song,level,lyrics
A Day In The Life,2,"I read the news today, oh boy<br>About a lucky man who made the grade<br>And though the news was rather sad<br>Well, I just had to laugh<br>I saw the photograph<br><br>He blew his mind out in a car;<br>He didn't notice that the lights had changed<br>A crowd of people stood and stared<br>They'd seen his face before<br>Nobody was really sure if he was from the House of Lords<br><br>I saw a film today, oh boy;<br>The English army had just won the war<br>A crowd of people turned away<br>But I just had to look<br>Having read the book<br><br>I'd love to turn you on<br><br>Woke up, fell out of bed<br>Dragged a comb across my head<br>Found my way downstairs and drank a cup<br>And looking up, I noticed I was late<br><br>Found my coat and grabbed my hat<br>Made the bus in seconds flat<br>Found my way upstairs and had a smoke<br>And somebody spoke and I went into a dream<br><br>Ah I read the news today, oh boy<br>Four thousand holes in Blackburn, Lancashire<br>And though the holes were rather small<br>They had to count them all<br>Now they know how many holes it takes to fill the Albert Hall<br><br>I'd love to turn you on"
A Hard Day's Night,1,"It's been a hard day's night, and I've been working like a dog<br>It's been a hard day's night, I should be sleeping like a log<br>But when I get home to you I find the things that you do<br>Will make me feel alright<br><br>You know I work all day to get you money to buy you things<br>And it's worth it just to hear you say you're going to give me everything<br>So why on earth should I moan, cos when I get you alone<br>You know I feel OK<br><br>When I'm home everything seems to be right<br>When I'm home feeling you holding me tight, tight, yeah<br><br>It's been a hard day's night, and I've been working like a dog<br>It's been a hard day's night, I should be sleeping like a log<br>But when I get home to you I find the things that you do<br>Will make me feel alright owww<br><br>So why on earth should I moan, cos when I get you alone<br>You know I feel OK<br><br>When I'm home everything seems to be right<br>When I'm home feeling you holding me tight, tight, yeah<br><br>It's been a hard day's night, and I've been working like a dog<br>It's been a hard day's night, I should be sleeping like a log<br>But when I get home to you I find the things that you do<br>Will make me feel alright<br>You know I feel alright<br>You know I feel alright"
A Taste Of Honey,4,"A taste of honey<br>Tasting much sweeter than wine<br><br>I dream of your first kiss<br>And then I feel upon my lips again<br><br>A taste of honey<br>Tasting much sweeter than wine<br><br>I will return, yes I will return<br>I'll come back for the honey and you<br><br>Yours was the kiss that awoke my heart<br>There lingers still, though we're far apart<br><br>That taste of honey<br>Tasting much sweeter than wine<br><br>Oh I will return, yes I will return<br>I'll come back (He'll come back)<br>for the honey (For the honey)<br>and you"
Across The Universe,2,"Words are flowing out like endless rain into a paper cup<br>They slither while they pass, they slip away across the universe<br>Pools of sorrow waves of joy are drifting through my opened mind<br>Possessing and caressing me<br><br>Jai guru deva om<br>Nothing's gonna change my world<br>Nothing's gonna change my world<br>Nothing's gonna change my world<br>Nothing's gonna change my world<br><br>Images of broken light which dance before me like a million eyes<br>They call me on and on across the universe<br>Thoughts meander like a restless wind<br>Inside a letter box they<br>Tumble blindly as they make their way<br>Across the universe<br><br>Jai guru deva om<br>Nothing's gonna change my world<br>Nothing's gonna change my world<br>Nothing's gonna change my world<br>Nothing's gonna change my world<br><br>Sounds of laughter shades of life are ringing<br>Through my open ears inciting and inviting me<br>Limitless undying love which shines around me like a million suns<br>And calls me on and on across the universe<br><br>Jai guru deva om<br>Nothing's gonna change my world<br>Nothing's gonna change my world<br>Nothing's gonna change my world<br>Nothing's gonna change my world<br><br>Jai guru deva<br>Jai guru deva<br>Jai guru deva<br>Jai guru deva<br>Jai guru deva<br>Jai guru deva..."
Act Naturally,4,"They're gonna put me in the movies<br>They're gonna make a big star out of me<br>We'll make a film about a man that's sad and lonely<br>And all I gotta do is act naturally<br><br>Well, I'll bet you I'm gonna be a big star<br>Might win an Oscar you can never tell<br>The movies gonna make me a big star<br>'Cause I can play the part so well<br><br>Well I hope you'll come and see me in the movies<br>Then I'll know that you will plainly see<br>The biggest fool that ever hit the big time<br>And all I gotta do is act naturally<br><br>We'll make the scene about a man that's sad and lonely<br>And begging down upon his bended knee<br>I'll play the part and I won't need rehearsing<br>All I have to do is act naturally<br><br>Well, I'll bet you I'm gonna be a big star<br>Might win an Oscar you can never tell<br>The movies gonna make me a big star<br>'Cause I can play the part so well<br><br>Well I hope you'll come and see me in the movies<br>Then I'll know that you will plainly see<br>The biggest fool that ever hit the big time<br>And all I gotta do is act naturally"
All I've Got To Do,4,"Whenever I want you around, yeah<br>All I gotta do is call you on the phone<br>And you'll come running home<br>yeah that's all I gotta do<br><br>And when I wanna kiss you, yeah<br>All I gotta do is whisper in your ear<br>The words you long to hear<br>And I'll be kissin' you<br><br>And the same goes for me, whenever you want me at all<br>I'll be here, yes I will, whenever you call<br>You just gotta call on me, yeah<br>You just gotta call on me<br><br>And when I wanna kiss you, yeah<br>All I gotta do is call you on the phone<br>And you'll come running home<br>Yeah, that's all I gotta do<br><br>And the same goes for me, whenever you want me at all<br>I'll be here, yes I will, whenever you call<br>You just gotta call on me, yeah<br>You just gotta call on me. Oh, you just gotta call on me<br><br>Mmmmmm mm mm"
All My Loving,2,"Close your eyes and I'll kiss you<br>Tomorrow I'll miss you<br>Remember I'll always be true<br>And then while I'm away<br>I'll write home every day<br>And I'll send all my loving to you<br><br>I'll pretend that I'm kissing<br>The lips I am missing<br>And hope that my dreams will come true<br>And then while I'm away<br>I'll write home every day<br>And I'll send all my loving to you<br><br>All my loving I will send to you<br>All my loving, darling I'll be true<br><br>Close your eyes and I'll kiss you<br>Tomorrow I'll miss you<br>Remember I'll always be true<br>And then while I'm away<br>I'll write home every day<br>And I'll send all my loving to you<br><br>All my loving I will send to you<br>All my loving, darling I'll be true<br>All my loving, all my loving ooh<br>All my loving I will send to you"
All Together Now,4,"One, two, three, four<br>Can I have a little more?<br>Five, six, seven, eight, nine, ten, I love you<br><br>A, B, C, D<br>Can I bring my friend to tea?<br>E, F, G, H, I, J, I love you<br><br>(Bom bom bom bompa bom) Sail the ship<br>(Bompa bom) Chop the tree<br>(Bompa bom) Skip the rope<br>(Bompa bom) Look at me<br><br>(All together now) All together now<br>(All together now) All together now<br>(All together now) All together now<br>(All together now) All together now<br><br>Black, white, green, red<br>Can I take my friend to bed?<br>Pink, brown, yellow, orange and blue, I love you<br><br>(All together now) All together now<br>(All together now) All together now<br>(All together now) All together now<br>(All together now) All together now<br>(All together now) All together now<br>(All together now) All together now<br>(All together now) All together now<br>(All together now) All together now<br>(All together now) All together now<br><br>(Bom bom bom) Sail the ship<br>(Bompa bom) Chop the tree<br>(Bompa bom) Skip the rope<br>(Bompa bom) Look at me<br><br>(All together now) All together now<br>(All together now) All together now<br>(All together now) All together now<br>(All together now) All together now<br>(All together now) All together now<br>(All together now) All together now<br>(All together now) All together now<br>(All together now) All together now<br>(All together now) All together now<br>(All together now) All together now<br>(All together now) All together now<br>(All together now) All together now"
All You Need Is Love,1,"Love, love, love<br>Love, love, love<br>Love, love, love<br><br>There's nothing you can do that can't be done<br>Nothing you can sing that can't be sung<br>Nothing you can say but you can learn how to play the game<br>It's easy<br><br>Nothing you can make that can't be made<br>No one you can save that can't be saved<br>Nothing you can do but you can learn how to be you in time<br>It's easy<br><br>All you need is love<br>All you need is love<br>All you need is love, love<br>Love is all you need<br><br>Love, love, love<br>Love, love, love<br>Love, love, love<br><br>All you need is love<br>All you need is love<br>All you need is love, love<br>Love is all you need<br><br>Nothing you can know that isn't known<br>Nothing you can see that isn't shown<br>Nowhere you can be that isn't where you're meant to be<br>It's easy<br><br>All you need is love<br>All you need is love<br>All you need is love, love<br>Love is all you need<br><br>All you need is love (All together, now!)<br>All you need is love (Everybody!)<br>All you need is love, love<br>Love is all you need<br>Love is all you need (Love is all you need)<br>Love is all you need (Love is all you need)<br>Love is all you need (Love is all you need)<br>Love is all you need (Love is all you need)<br>Love is all you need (Love is all you need)<br>Love is all you need (Love is all you need)<br>Love is all you need (Love is all you need)<br>Love is all you need (Love is all you need)<br>Love is all you need (Love is all you need)<br>Love is all you need (Love is all you need)<br>Love is all you need (Love is all you need)<br>Yee-hai! (Love is all you need)<br>Love is all you need (Love is all you need)<br><br>Yesterday (Love is all you need)<br>Love is all you need (Love is all you need)<br>Love is all you need (Love is all you need)<br>Love is all you need (Love is all you need)<br>Oh yeah! (Love is all you need)<br>She loves you, yeah yeah yeah (Love is all you need)<br>She loves you, yeah yeah yeah (Love is all you need)"
And I Love Her,2,I give her all my love<br>That's all I do<br>And if you saw my love<br>You'd love her too<br>I love her<br><br>She gives me everything<br>And tenderly<br>The kiss my lover brings<br>She brings to me<br>And I love her<br><br>A love like ours<br>Could never die<br>As long as I<br>Have you near me<br><br>Bright are the stars that shine<br>Dark is the sky<br>I know this love of mine<br>Will never die<br>And I love her<br><br>Bright are the stars that shine<br>Dark is the sky<br>I know this love of mine<br>Will never die<br>And I love her
And Your Bird Can Sing,4,"You tell me that you've got everything you want<br>And your bird can sing<br>But you don't get me, you don't get me<br><br>You say you've seen Seven Wonders and your bird is green<br>But you can't see me, you can't see me<br><br>When your prized possessions start to weigh you down<br>Look in my direction, I'll be 'round, I'll be 'round<br><br>When your bird is broken will it bring you down<br>You may be awoken, I'll be 'round, I'll be 'round<br><br>You tell me that you've heard every sound there is<br>And your bird can swing<br>But you can't hear me, you can't hear me"
Anna (Go To Him),4,"Anna<br>You come and ask me, girl<br>To set you free, girl<br>You say he loves you more than me<br>So I will set you free<br>Go with him (Anna)<br>Go with him (Anna)<br><br>Anna<br>Girl, before you go now<br>I want you to know, now<br>That I still love you so<br>But if he loves you more<br>Go with him<br><br>All of my life<br>I've been searching for a girl<br>To love me like I love you<br>Oh, now, but every girl I've ever had<br>Breaks my heart and leave me sad<br>What am I, what am I supposed to do<br><br>Anna<br>Just one more thing, girl<br>You give back your ring to me, and I will set you free<br>Go with him<br><br>All of my life<br>I've been searching for a girl<br>To love me like I love you<br>But let me tell you now<br>But every girl I've ever had<br>Breaks my heart and leave me sad<br>What am I, what am I supposed to do<br><br>Anna<br>Just one more thing, girl<br>You give back your ring to me,<br>And I will set you free<br>Go with him<br><br>(Anna) Go with him<br>(Anna) You can go with him, girl<br>(Anna) Go with him"
Another Girl,4,"For I have got another girl, another girl<br>You're making me say that I've got nobody but you<br>But as from today, well, I've got somebody that's new<br>I ain't no fool and I don't take what I don't want<br><br>For I have got another girl, another girl<br>She's sweeter than all the girls and I met quite a few<br>Nobody in all the world can do what she can do<br>And so I'm telling you, This time you'd better stop<br><br>For I have got another girl, another girl<br>Who will love me till the end<br>Through thick and thin<br>She will always be my friend<br><br>I don't want to say that I've been unhappy with you<br>But, as from today, well, I've seen somebody that's new<br>I ain't no fool and I don't take what I don't want<br><br>For I have got another girl, another girl<br>Who will love me till the end<br>Through thick and thin<br>She will always be my friend<br><br>I don't want to say that I've been unhappy with you<br>But, as from today, well, I've seen somebody that's new<br>I ain't no fool and I don't take what I don't want<br><br>For I have got another girl, another girl<br>Another girl"
Any Time At All,4,"Any time at all, any time at all<br>Any time at all, all you've gotta do is call and I'll be there<br><br>If you need somebody to love<br>Just look into my eyes<br>I'll be there to make you feel right<br><br>If you're feeling sorry and sad<br>I'd really sympathize<br>Don't you be sad, just call me tonight<br><br>Any time at all, any time at all<br>Any time at all, all you've gotta do is call and I'll be there<br><br>If the sun has faded away<br>I'll try to make it shine<br>There's nothing I won't do<br>When you need a shoulder to cry on<br>I hope it will be mine<br>Call me tonight, and I'll come to you<br><br>Any time at all, any time at all<br>Any time at all, all you've gotta do is call and I'll be there<br><br>Any time at all, any time at all<br>Any time at all, all you've gotta do is call and I'll be there<br>Any time at all, all you've gotta do is call and I'll be there"
Ask Me Why,4,"I love you, 'cause you tell me things I want to know<br>And it's true that it really only goes to show<br>That I know that I, I, I, I<br>Should never, never, never be blue<br><br>Now you're mine, my happiness still makes me cry<br>And in time, you'll understand the reason why<br>If I cry, it's not because I'm sad<br>But you're the only love that I've ever had<br><br>I can't believe it's happened to me<br>I can't conceive of any more misery<br><br>Ask me why, I'll say I love you<br>And I'm always thinking of you<br><br>I love you, 'cause you tell me things I want to know<br>And it's true that it really only goes to show<br>That I know that I, I, I, I<br>Should never, never, never be blue<br><br>Ask me why, I'll say I love you<br>And I'm always thinking of you<br><br>I can't believe it's happened to me<br>I can't conceive of any more misery<br><br>Ask me why, I'll say I love you<br>And I'm always thinking of you<br>You, you"
Baby It's You,4,"Sha la la la la la la la<br>Sha la la la la la la la<br>Sha la la la la la la la<br>Sha la la la la<br><br>It's not the way you smile that touched my heart. (sha la la la la)<br>It's not the way you kiss that tears me apart.<br><br>Uh, oh, many, many, many nights go by,<br>I sit alone at home and I cry over you.<br>What can I do.<br>Can't help myself, 'cause baby, it's you.<br>Baby, it's you.<br><br>You should hear what they say about you, ""cheat,"" ""cheat.""<br>They say, they say you never never never ever been true. (cheat cheat)<br><br>Uh oh,<br>It doesn't matter what they say,<br>I know I'm gonna love you any old way.<br>What can I do, and it's true.<br>Don't want nobody, nobody, 'cause baby, it's you. (sha la la la la la la)<br>Baby, it's you. (sha la la la la la la)<br><br>Uh oh,<br>It doesn't matter what they say,<br>I know I'm gonna love you any old way.<br>What can I do, when it's true.<br>Don't want nobody, nobody, 'cause baby, it's you. (sha la la la la la la)<br>Baby, it's you. (sha la la la la la la)<br>Don't leave me all alone..."
Baby You're A Rich Man,4,"How does it feel to be<br>One of the beautiful people?<br>Now that you know who you are.<br>What do you want to be?<br>And have you travelled very far?<br>Far as the eyes can see<br><br>How does it feel to be<br>One of the beautiful people?<br>How often have you been there?<br>Often enough to know<br>What did you see when you were there?<br>Nothing that doesn't show<br>Baby you're a rich man<br>Baby you're a rich man<br>Baby you're a rich man too<br>You keep all your money in a big brown bag inside a zoo<br>What a thing to do<br>Baby you're a rich man<br>Baby you're a rich man<br>Baby you're a rich man too<br><br>How does it feel to be<br>One of the beautiful people?<br>Tuned to a natural E<br>Happy to be that way<br>Now that you've found another key<br>What are you going to play?<br>Baby you're a rich man<br>Baby you're a rich man<br>Baby you're a rich man too<br>You keep all your money in a big brown bag inside a zoo<br>What a thing to do<br>Baby, baby you're a rich man<br>Baby you're a rich man<br>Baby you're a rich man too<br>Baby you're a rich man<br>Baby you're a rich man<br>Baby, baby you're a rich man too (fade out)"
Baby's In Black,4,"Oh dear, what can I do?<br>Baby's in black and I'm feeling blue<br>Tell me, oh what can I do?<br><br>She thinks of him and so she dresses in black<br>And though he'll never come back, she's dressed in black<br>Oh dear, what can I do?<br>Baby's in black and I'm feeling blue<br>Tell me, oh what can I do?<br><br>I think of her, but she thinks only of him<br>And though it's only a whim, she thinks of him<br>Oh how long will it take<br>Till she sees the mistake she has made?<br>Dear what can I do?<br>Baby's in black and I'm feeling blue<br>Tell me, oh what can I do?<br><br>Oh how long it will take<br>Till she sees the mistake she has made?<br>Dear what can I do?<br>Baby's in black and I'm feeling blue<br>Tell me, oh what can I do?<br><br>She thinks of him and so she dresses in black<br>And though he'll never come back, she's dressed in black<br>Oh dear, what can I do?<br>Baby's in black and I'm feeling blue<br>Tell me, oh what can I do?"
Back In The U.S.S.R.,2,"Oh, flew in by Miami Beach B.O.A.C.<br>Didn't get to bed last night<br>On the way the paper bag was on my knee<br>Man I had a dreadful flight<br><br>I'm back in the U.S.S.R.<br>You don't know how lucky you are boy<br>Back in the U.S.S.R. (Yeah)<br><br>Been away so long I hardly knew the place<br>Gee it's good to be back home<br>Leave it 'til tomorrow to unpack my case<br>Honey disconnect the phone<br><br>I'm back in the U.S.S.R.<br>You don't know how lucky you are boy<br>Back in the U.S.<br>Back in the U.S.<br>Back in the U.S.S.R.<br><br>Well the Ukraine girls really knock me out<br>They leave the West behind<br>And Moscow girls make me sing and shout<br>That Georgia's always on my my my my my my my my my mind<br><br>Aw come on!<br>Ho yeah!<br>Ho yeah!<br>Ho ho yeah!<br>Yeah yeah!<br><br>Yeah I'm back in the U.S.S.R.<br>You don't know how lucky you are boys<br>Back in the U.S.S.R.<br><br>Well the Ukraine girls really knock me out<br>They leave the West behind<br>And Moscow girls make me sing and shout<br>That Georgia's always on my my my my my my my my my mind<br><br>Oh, show me 'round your snow-peaked mountains way down south<br>Take me to your daddy's farm<br>Let me hear your balalaikas ringing out<br>Come and keep your comrade warm<br><br>I'm back in the U.S.S.R.<br>Hey you don't know how lucky you are boys<br>Back in the U.S.S.R.<br><br>Oh let me tell you, honey<br>Hey, I'm back!<br>I'm back in the U.S.S.R.<br>Yes, I'm free!<br>Yeah, back in the U.S.S.R.<br><br>Ha ha"
Bad Boy,4,"A bad little kid moved into my neighborhood<br>He won't do nothing right just sitting down and looks so good<br>He don't want to go to school and learn to read and write<br>Just sits around the house and plays the rock and roll music all night<br>Well, he put some tacks on teachers chair<br>Puts chewing gum in little girl's hair<br>Hey, junior, behave yourself<br><br>Buys every rock and roll book on the magazine stand<br>Every dime that he get is lost to the jukebox man<br>Well he worries his teacher till at night she's ready to poop<br>From rocking and a-rolling spinning in a hula hoop<br>Well this rock and roll has got to stop<br>Junior's head is hard as rock<br>Now, junior, behave yourself<br><br>Going tell your mama you better do what she said<br>Get to the barber shop and get that hair cut off your head<br>Threw the canary and you fed it to the neighbors cat<br>You gave the cocker spaniel a bath in mother's laundramat<br>Well, mama's head has got to stop<br>Junior's head is hard as rock<br>Now, junior, behave yourself"
Because,4,"Aaaaaahhhhhh...<br>Because the world is round it turns me on<br>Because the world is round...aaaaaahhhhhh<br><br>Because the wind is high it blows my mind<br>Because the wind is high...aaaaaaaahhhh<br><br>Love is old, love is new<br>Love is all, love is you<br><br>Because the sky is blue, it makes me cry<br>Because the sky is blue...aaaaaaaahhhh<br><br>Aaaaahhhhhhhhhh...<br>Aaaaahhhhhhhhhh...<br>Aaaaahhhhhhhhhh..."
Being For The Benefit Of Mr Kite!,4,"For the benefit of Mr. Kite,<br>There will be a show tonight<br>On trampoline.<br><br>The Hendersons will all be there.<br>Late of Pablo Fanque's Fair.<br>What a scene!<br><br>Over men and horses, hoops and garters,<br>Lastly through a hogshead of real fire!<br>In this way<br>Mr. K.<br>Will challenge the world!<br><br>The celebrated Mr. K.<br>Performs his feat on Saturday<br>At Bishopsgate.<br><br>The Hendersons will dance and sing<br>As Mr. Kite flies through the ring.<br>Don't be late!<br><br>Messrs. K. and H. assure the public<br>Their production will be second to none.<br>And of course<br>Henry The Horse<br>Dances the waltz!<br><br>The band begins at ten to six,<br>When Mr. K. performs his tricks<br>Without a sound.<br><br>And Mr. H. will demonstrate<br>Ten summersets he'll undertake<br>On solid ground.<br><br>Having been some days in preparation,<br>A splendid time is guaranteed for all.<br>And tonight<br>Mr. Kite<br>Is topping the bill!"
Birthday,4,"They say it's your birthday<br>It's my birthday too, yeah<br>They say it's your birthday<br>We're gonna have a good time<br>I'm glad it's your birthday<br>Happy birthday to you<br><br>Ah<br>Ah<br>Ah<br>Come on<br>Come on<br><br>Yes we're going to a party party<br>Yes we're going to a party party<br>Yes we're going to a party party<br><br>I would like you to dance (Birthday)<br>Take a cha-cha-cha-chance (Birthday)<br>I would like you to dance (Birthday)<br>Dance yeah<br><br>Oh<br>Come on<br><br>I would like you to dance (Birthday)<br>Take a cha-cha-cha-chance (Birthday)<br>I would like you to dance (Birthday)<br>Oh dance! Dance<br><br>They say it's your birthday<br>Well it's my birthday too, yeah<br>They say it's your birthday<br>We're gonna have a good time<br>I'm glad it's your birthday<br>Happy birthday to you"
Blackbird,3,"Blackbird singing in the dead of night<br>Take these broken wings and learn to fly<br>All your life<br>You were only waiting for this moment to arise<br><br>Blackbird singing in the dead of night<br>Take these sunken eyes and learn to see<br>All your life<br>You were only waiting for this moment to be free<br><br>Blackbird fly, blackbird fly<br>Into the light of the dark black night<br><br>Blackbird fly, blackbird fly<br>Into the light of the dark black night<br><br>Blackbird singing in the dead of night<br>Take these broken wings and learn to fly<br>All your life<br>You were only waiting for this moment to arise<br>You were only waiting for this moment to arise<br>You were only waiting for this moment to arise"
Blue Jay Way,4,"There's a fog upon L.A.,<br>And my friends have lost their way.<br>""We'll be over soon,"" they said.<br>Now they've lost themselves instead<br><br>Please don't be long<br>Please don't you be very long<br>Please don't be long for I may be asleep<br><br>Well, it only goes to show<br>And I told them where to go<br>Ask a policeman on the street<br>There's so many there to meet<br><br>Please don't be long<br>Please don't you be very long<br>Please don't be long for I may be asleep<br><br>Now it's past my bed I know<br>And I'd really like to go<br>Soon will be the break of day<br>Sitting here in Blue Jay Way<br><br>Please don't be long<br>Please don't you be very long<br>Please don't be long for I may be asleep<br><br>Please don't be long<br>Please don't you be very long<br>Please don't be long<br><br>Please don't be long<br>Please don't you be very long<br>Please don't be long<br><br>Please don't be long<br>Please don't you be very long<br>Please don't be long<br><br>Don't be long, don't be long, don't be long<br>Don't be long, don't be long, don't be long"
