song,level,lyrics
Rocky Raccoon,4,"Now somewhere in the Black Mountain Hills of Dakota<br>There lived a young boy named Rocky Raccoon<br>And one day his woman ran off with another guy<br>Hit young Rocky in the eye Rocky didn't like that<br>He said ""I'm gonna get that boy""<br>So one day he walked into town<br>Booked himself a room in the local saloon<br><br>Rocky Raccoon checked into his room<br>Only to find Gideon's Bible<br>Rocky had come, equipped with a gun<br>To shoot off the legs of his rival<br><br>His rival, it seems, had broken his dreams<br>By stealing the girl of his fancy<br>Her name was Magill, and she called herself Lil<br>But everyone knew her as Nancy<br><br>Now she and her man, who called himself Dan<br>Were in the next room at the hoedown<br>Rocky burst in, and grinning a grin<br>He said, ""Danny boy, this is a showdown""<br><br>But Daniel was hot, he drew first and shot<br>And Rocky collapsed in the corner, ah<br><br>D'da d'da d'da da da da<br>D'da d'da d'da da da da<br>D'da d'da d'da da d'da d'da d'da d'da<br>Do do do do do do<br><br>D'do d'do d'do do do do<br>D'do d'do d'do do do do<br>D'do d'do d'do do do d'do d'do d'do d'do<br>Do do do do do do<br><br>Now, the doctor came in, stinking of gin<br>And proceeded to lie on the table<br>He said, ""Rocky, you met your match""<br>And Rocky said, ""Doc, it's only a scratch<br>And I'll be better, I'll be better, Doc, as soon as I am able""<br><br>And now Rocky Raccoon, he fell back in his room<br>Only to find Gideon's Bible<br>Gideon checked out and he left it no doubt<br>To help with good Rocky's revival, ah<br>Oh yeah, yeah<br><br>D'do d'do d'do do do do<br>D'do d'do d'do do do do<br>D'do d'do d'do do do d'do d'do d'do d'do<br>Do do do do do do<br><br>D'do d'do d'do do do do, come on, Rocky boy<br>D'do d'do d'do do do do, come on, Rocky boy<br>D'do d'do d'do do do d'do d'do d'do d'do<br>The story of Rocky there"
Roll Over Beethoven,3,Well gonna write a little letter<br>Gonna mail it to my local D.J.<br>It's a rocking little record<br>I want my jockey to play<br>Roll over Beethoven<br>Gotta hear it again today<br><br>You know my temperature's rising<br>And the jukebox blows a fuse<br>My heart beating rhythm<br>While my soul keeps singing the blues<br>Roll over Beethoven<br>And tell Tchaikovsky the news<br><br>I got a rocking pneumonia<br>I need a shot of rhythm and blues<br>I think I caught it off the writer<br>Sittin' down by the rhythm reviews<br>Roll over Beethoven<br>We're rockin' in two by two<br><br>Well if you feel it and like it<br>Well get your lover and reel and rock it<br>Roll it over and move on up<br>Just triffle further and reel and rock it<br>Roll it over<br>Roll over Beethoven<br>A rocking in two by two - Ooo<br><br>Well early in the morning<br>I'm a giving you the warning<br>Don't you step on my blue suede shoes<br>Hey diddle diddle<br>I'll play my fiddle<br>Ain't got nothing to lose<br>Roll over Beethoven<br>And tell Tchaikovsky the news<br><br>You know she wiggles like a glow worm<br>Dance like a spinning top<br>She's got a crazy partner<br>Oughta see them reel an rock<br>Long as she's got a dime<br>The music will never stop<br>Roll over Beethoven<br>Roll over Beethoven<br>Roll over Beethoven<br>Roll over Beethoven<br>Roll over Beethoven<br>Dig to these rhythm and blues
Run For Your Life,4,"Well, I'd rather see you dead, little girl<br>Than to be with another man<br>You better keep your head, little girl<br>Or I won't know where I am<br><br>You better run for your life if you can, little girl<br>Hide your head in the sand, little girl<br>Catch you with another man<br>That's the end, ah, little girl<br><br>Well, you know that I'm a wicked guy<br>And I was born with a jealous mind<br>And I can't spend my whole life trying<br>Just to make you toe the line<br><br>You better run for your life if you can, little girl<br>Hide your head in the sand, little girl<br>Catch you with another man<br>That's the end, ah, little girl<br><br>Let this be a sermon<br>I mean everything I've said<br>Baby, I'm determined<br>And I'd rather see you dead<br><br>You better run for your life if you can, little girl<br>Hide your head in the sand, little girl<br>Catch you with another man<br>That's the end, ah, little girl<br><br>I'd rather see you dead, little girl<br>Than to be with another man<br>You better keep your head, little girl<br>Or you won't know where I am<br><br>You better run for your life if you can, little girl<br>Hide your head in the sand, little girl<br>Catch you with another man<br>That's the end, ah, little girl<br><br>Nah nah nah<br>Nah nah nah<br>Nah nah nah<br>Nah nah nah"
Savoy Truffle,4,"Creme tangerine and montelimar<br>A ginger sling with a pineapple heart<br>A coffee dessert, yes, you know it's good news<br>But you'll have to have them all pulled out<br>After the Savoy truffle<br><br>Cool cherry cream, nice apple tart<br>I feel your taste all the time we're apart<br>Coconut fudge really blows down those blues<br>But you'll have to have them all pulled out<br>After the Savoy truffle<br><br>You might not feel it now<br>But when the pain cuts through<br>You're going to know and how<br>The sweat is going to fill your head<br>When it becomes too much<br>You'll shout aloud<br><br>But you'll have to have them all pulled out<br>After the Savoy truffle<br><br>You know that what you eat you are<br>But what is sweet now turns so sour<br>We all know obla-dibla-da<br>But can you show me where you are?<br><br>Creme tangerine and montelimar<br>A ginger sling with a pineapple heart<br>A coffee dessert, yes, you know it's good news<br>But you'll have to have them all pulled out<br>After the Savoy truffle<br><br>Yes you'll have to have them all pulled out<br>After the Savoy truffle"
Sexy Sadie,4,Sexy Sadie what have you done<br>You made a fool of everyone<br>You made a fool of everyone<br>Sexy Sadie ooh what have you done<br><br>Sexy Sadie you broke the rules<br>You layed it down for all to see<br>You layed it down for all to see<br>Sexy Sadie oooh you broke the rules<br><br>One sunny day the world was waiting for a lover<br>She came along to turn on everyone<br>Sexy Sadie the greatest of them all<br><br>Sexy Sadie how did you know<br>The world was waiting just for you<br>The world was waiting just for you<br>Sexy Sadie oooh how did you know<br><br>Sexy Sadie you'll get yours yet<br>However big you think you are<br>However big you think you are<br>Sexy Sadie oooh you'll get yours yet<br><br>We gave her everything we owned just to sit at her table<br>Just a smile would lighten everything<br>Sexy Sadie she's the latest and the greatest of them all<br><br>She made a fool of everyone<br>Sexy Sadie<br><br>However big you think you are<br>Sexy Sadie
Sgt. Pepper's Lonely Hearts Club Band,2,"It was twenty years ago today<br>Sergeant Pepper taught the band to play<br>They've been going in and out of style<br>But they're guaranteed to raise a smile<br>So may I introduce to you<br>The act you've known for all these years?<br>Sergeant Pepper's Lonely Hearts Club Band<br><br>We're Sergeant Pepper's Lonely Hearts Club Band<br>We hope you will enjoy the show<br>We're Sergeant Pepper's Lonely Hearts Club Band<br>Sit back and let the evening go<br>Sergeant Pepper's lonely, Sgt. Pepper's lonely<br>Sergeant Pepper's Lonely Hearts Club Band<br><br>It's wonderful to be here<br>It's certainly a thrill<br>You're such a lovely audience<br>We'd like to take you home with us<br>We'd love to take you home<br><br>I don't really want to stop the show<br>But I thought you might like to know<br>That the singer's going to sing a song<br>And he wants you all to sing along<br>So let me introduce to you<br>The one and only Billy Shears<br>And Sergeant Pepper's Lonely Hearts Club Band, yeah"
Sgt. Pepper's Lonely Hearts Club Band (Reprise),4,"(1,2,3,4<br><br>Bye!)<br><br>We're Sgt. Pepper's Lonely Hearts Club Band<br>We hope you have enjoyed the show<br>Sgt. Pepper's Lonely Hearts Club Band<br>We're sorry but it's time to go<br>Sgt. Pepper's lonely, Sgt. Pepper's lonely<br>Sgt. Pepper's lonely, Sgt. Pepper's lonely<br>Sgt. Pepper's Lonely Hearts Club Band<br>We'd like to thank you once again<br>Sgt. Pepper's one and only Lonely Hearts Club Band<br>It's getting very near the end<br>Sgt. Pepper's lonely, Sgt. Pepper's lonely<br>Sgt. Pepper's Lonely Hearts Club Band"
She Came In Through The Bathroom Window,4,"(Gonna come out now<br>Ha ha ha<br>Wow look out.)<br><br>She came in through the bathroom window<br>Protected by a silver spoon<br>But now she sucks her thumb and wonders<br>By the banks of her own lagoon<br><br>Didn't anybody tell her?<br>Didn't anybody see?<br>Sunday's on the phone to Monday<br>Tuesday's on the phone to me<br><br>She said she'd always been a dancer<br>She worked at fifteen clubs a day<br>And though she thought I knew the answer<br>Well, I knew what I could not say<br><br>And so I quit the police department<br>And got myself a steady job<br>And though she tried her best to help me<br>She could steal, but she could not rob<br><br>Didn't anybody tell her?<br>Didn't anybody see?<br>Sunday's on the phone to Monday<br>Tuesday's on the phone to me, oh yeah"
She Loves You,1,"She loves you, yeah, yeah, yeah<br>She loves you, yeah, yeah, yeah<br>She loves you, yeah, yeah, yeah, yeah<br><br>You think you lost your love<br>Well, I saw her yesterday<br>It's you she's thinking of<br>And she told me what to say<br><br>She says she loves you<br>And you know that can't be bad<br>Yes, she loves you<br>And you know you should be glad<br><br>She said you hurt her so<br>She almost lost her mind<br>But now she says she knows<br>You're not the hurting kind<br><br>She says she loves you<br>And you know that can't be bad<br>Yes, she loves you<br>And you know you should be glad, ooh<br><br>She loves you, yeah, yeah, yeah<br>She loves you, yeah, yeah, yeah<br>And with a love like that<br>You know you should be glad<br><br>You know it's up to you<br>I think it's only fair<br>Pride can hurt you too<br>Apologize to her<br><br>Because she loves you<br>And you know that can't be bad<br>Yes, she loves you<br>And you know you should be glad, ooh<br><br>She loves you, yeah, yeah, yeah<br>She loves you, yeah, yeah, yeah<br>With a love like that<br>You know you should be glad<br>With a love like that<br>You know you should be glad<br>With a love like that<br>You know you should be glad<br>Yeah, yeah, yeah<br>Yeah, yeah, yeah, yeah"
She Said She Said,4,"She said, ""I know what it's like to be dead.<br>I know what it is to be sad.""<br>And she's making me feel like I've never been born<br><br>I said, ""Who put all those things in your head?<br>Things that make me feel that I'm mad.<br>And you're making me feel like I've never been born.""<br><br>She said, ""You don't understand what I said.""<br>I said, ""No, no, no, you're wrong.<br>When I was a boy everything was right,<br>Everything was right.""<br><br>I said, ""Even though you know what you know,<br>I know that I'm ready to leave<br>'Cause you're making me feel like I've never been born.""<br><br>She said, ""You don't understand what I said.""<br>I said, ""No, no, no, you're wrong.<br>When I was a boy everything was right,<br>Everything was right.""<br><br>I said, ""Even though you know what you know,<br>I know that I'm ready to leave<br>'Cause you're making me feel like I've never been born.""<br><br>She said, ""I know what it's like to be dead.<br>I know what it is to be sad.<br>I know what it's like to be dead..."""
She's A Woman,4,"My love don't give me presents<br>I know that she's no peasant<br>Only ever has to give me<br>Love forever and forever<br>My love don't give me presents<br>Turn me on when I get lonely<br>People tell me that she's only<br>Fooling, I know she isn't<br><br>She don't give the boys the eye<br>She hates to see me cry<br>She is happy just to hear me say<br>That I will never leave her<br>She don't give the boys the eye<br>She will never make me jealous<br>Gives me all her time as well as<br>Loving, don't ask me why<br><br>She's a woman who understands<br>She's a woman who loves her man<br><br>My love don't give me presents<br>I know that she's no peasant<br>Only ever has to give me love<br>Forever and forever<br>My love don't give me presents<br>Turn me on when I get lonely<br>People tell me that she's only<br>Fooling, I know she isn't<br><br>She's a woman who understands<br>She's a woman who loves her man<br><br>My love don't give me presents<br>I know that she's no peasant<br>Only ever has to give me<br>Love forever and forever<br>My love don't give me presents<br>Turn me on when I get lonely<br>People tell me that she's only<br>Fooling, I know she isn't<br><br>She's a woman, she's a woman<br>She's a woman, she's a woman"
She's Leaving Home,4,"Wednesday morning at five o'clock as the day begins<br>Silently closing her bedroom door<br>Leaving the note that she hoped would say more<br>She goes downstairs to the kitchen clutching her handkerchief<br>Quietly turning the backdoor key<br>Stepping outside she is free<br><br>She (We gave her most of our lives)<br>Is leaving (Sacrificed most of our lives)<br>Home (We gave her everything money could buy)<br>She's leaving home after living alone<br>For so many years (Bye bye)<br><br>Father snores as his wife gets into her dressing gown<br>Picks up the letter that's lying there<br>Standing alone at the top of the stairs<br>She breaks down and cries to her husband ""Daddy our baby's gone<br>Why would she treat us so thoughtlessly?<br>How could she do this to me?""<br><br>She (We never thought of ourselves)<br>Is leaving (Never a thought for ourselves)<br>Home (We struggled hard all our lives to get by)<br>She's leaving home after living alone<br>For so many years (Bye bye)<br><br>Friday morning at nine o'clock she is far away<br>Waiting to keep the appointment she made<br>Meeting a man from the motor trade<br><br>She (What did we do that was wrong)<br>Is having (We didn't know it was wrong)<br>Fun (Fun is the one thing that money can't buy)<br>Something inside that was always denied<br>For so many years (Bye bye)<br><br>She's leaving home<br>Bye bye"
Sie Liebt Dich,4,"Sie liebt dich, yeh, yeh, yeh<br>Sie liebt dich, yeh, yeh, yeh<br>Sie liebt dich, yeh, yeh, yeh, yeah<br><br>Du glaubst sie liebt nur mich<br>Gestern had ich sie gesehen<br>Sie denkt ja nur an dich<br>Und du solltest zu ihr gehen<br>Oh, ja sie liebt dich<br>Schoner kann es garnicht sein<br>Ja, sie liebt dich<br>Und da solltest du dich freuen<br><br>Du hast ihr weh getan<br>Sie wusste nicht warum<br>Du warst nicht schuld daran<br>Und drehtest dich nicht um<br>Oh, ja sie liebt dich<br>Schoner kann es garnicht sein<br>Ja, sie liebt dich<br>Und da solltest du dich freuen, ooo<br><br>Sie liebt dich, yeh, yeh, yeh<br>Sie liebt dich, yeh, yeh, yeh<br>Denn mit dir allein<br>Kann sie nur glucklich sein<br><br>Du musst jetzt zu ihr gehen<br>Entschuldige dich bei ihr<br>Ja das wird sie verstehen<br>Und dann verzeit sie dir<br>Oh, ja sie liebt dich<br>Schoner kann es garnicht sein<br>Ja, sie liebt dich<br>Und da solltest du dich freuen, ooo<br><br>Sie liebt dich, yeh, yeh, yeh<br>Sie liebt dich, yeh, yeh, yeh<br>Denn mit dir allein<br>Kann sie nur glucklich sein<br><br>Denn mit dir allein<br>Kann sie nur glucklich sein<br><br>Denn mit dir allein<br>Kann sie nur glucklich sein<br>Sein<br><br>Yeh, yeh, yeh<br>Yeh, yeh, yeh, yeah"
Slow Down,4,"Well, come on pretty baby, won't you walk with me?<br>Come on, pretty baby, won't you talk with me?<br>Come on pretty baby, give me one more chance<br>Try to save our romance!<br><br>Slow down, baby, now you're movin' way too fast<br>You gotta gimme little lovin', gimme little lovin'<br>Ow! If you want our love to last<br><br>Well, I used to walk you home, baby, after school<br>Carry your books home, too<br>But now you got a boyfriend down the street<br>Baby what you're tryin' to do?<br><br>You better slow down!<br>Baby, now you're movin' way too fast<br>You gotta gimme little lovin', gimme little lovin'<br>Bbbbb! If you want our love to last<br><br>Well you know that I love you, tell the world I do<br>Come on, pretty baby, why can't you be true?<br>I need your lovin' baby, oh so bad<br>The best little woman I ever had<br><br>Slow down, baby, now you're movin' way too fast<br>You gotta gimme little lovin', gimme little lovin'<br>Ow! If you want our love to last"
Something,1,"Something in the way she moves<br>Attracts me like no other lover<br>Something in the way she woos me<br><br>I don't want to leave her now<br>You know I believe and how<br><br>Somewhere in her smile she knows<br>That I don't need no other lover<br>Something in her style that shows me<br><br>Don't want to leave her now<br>You know I believe and how<br><br>You're asking me will my love grow<br>I don't know, I don't know<br>You stick around, now it may show<br>I don't know, I don't know<br><br>Something in the way she knows<br>And all I have to do is think of her<br>Something in the things she shows me<br><br>I don't want to leave her now<br>You know I believe and how"
Strawberry Fields Forever,2,"Let me take you down, 'cause I'm going to Strawberry Fields<br>Nothing is real and nothing to get hung about<br>Strawberry Fields forever<br><br>Living is easy with eyes closed<br>Misunderstanding all you see<br>It's getting hard to be someone but it all works out<br>It doesn't matter much to me<br>Let me take you down, cause I'm going to Strawberry Fields<br>Nothing is real and nothing to get hung about<br>Strawberry Fields forever<br><br>No one I think is in my tree<br>I mean it must be high or low<br>That is you can't you know tune in but it's all right<br>That is I think it's not too bad<br>Let me take you down, cause I'm going to Strawberry Fields<br>Nothing is real and nothing to get hung about<br>Strawberry Fields forever<br><br>Always know, sometimes think it's me<br>But you know, I know when it's a dream<br>I think a ""No,"" I mean a ""Yes""<br>But it's all wrong<br>That is, I think I disagree<br><br>Let me take you down, cause I'm going to Strawberry Fields<br>Nothing is real and nothing to get hung about<br>Strawberry Fields forever<br>Strawberry Fields forever<br>Strawberry Fields forever"
Sun King,4,Aaaaahhhhhhhhhh...<br>Here comes the Sun King<br>Here comes the Sun King<br>Everybody's laughing<br>Everybody's happy<br>Here comes the Sun King<br><br>Quando paramucho mi amore de felice carathon<br>Mundo paparazzi mi amore cicce verdi parasol<br>Questo abrigado tantamucho que canite carousel
Taxman,3,"1,2,3,4<br><br>Hrmm!<br><br>1,2...<br><br>1,2,3,4.<br><br>Let me tell you how it will be<br>There's one for you, nineteen for me<br>Cos I'm the taxman, yeah, I'm the taxman<br><br>Should five per cent appear too small<br>Be thankful I don't take it all<br>Cos I'm the taxman, yeah I'm the taxman<br><br>If you drive a car, I'll tax the street<br>If you try to sit, I'll tax your seat<br>If you get too cold I'll tax the heat<br>If you take a walk, I'll tax your feet<br><br>Taxman!<br>Cos I'm the taxman, yeah I'm the taxman<br><br>Don't ask me what I want it for (Aahh Mr. Wilson)<br>If you don't want to pay some more (Aahh Mr. Heath)<br>Cos I'm the taxman, yeah, I'm the taxman<br><br>Now my advice for those who die<br>Declare the pennies on your eyes<br>Cos I'm the taxman, yeah, I'm the taxman<br><br>And you're working for no one but me<br>Taxman!"
Tell Me What You See,4,"If you let me take your heart I will prove to you<br>We will never be apart if I'm part of you<br>Open up your eyes now, tell me what you see<br>It is no surprise now, what you see is me<br><br>Big and black the clouds may be, time will pass away<br>If you put your trust in me I'll make bright your day<br>Look into these eyes now, tell me what you see<br>Don't you realise now, what you see is me<br>Tell me what you see<br><br>Listen to me one more time, how can I get through?<br>Can't you try to see that I'm trying to get to you?<br>Open up your eyes now, tell me what you see<br>It is no surprise now, what you see is me<br>Tell me what you see<br><br>Listen to me one more time, how can I get through?<br>Can't you try to see that I'm trying to get to you?<br>Open up your eyes now, tell me what you see<br>It is no surprise now, what you see is me"
Tell Me Why,4,"Tell me why you cried<br>And why you lied to me<br>Tell me why you cried<br>And why you lied to me<br><br>Well, I gave you everything I had<br>But you left me sitting on my own<br>Did you have to treat me oh so bad?<br>All I do is hang my head and moan<br><br>Tell me why you cried<br>And why you lied to me<br>Tell me why you cried<br>And why you lied to me<br><br>If it's something that I've said or done<br>Tell me what, and I'll apologize<br>If you don't I really can't go on<br>Holding back these tears in my eyes<br><br>Tell me why you cried<br>And why you lied to me<br>Tell me why you cried<br>And why you lied to me<br><br>Well, I beg you on my bended knees<br>If you'll only listen to my pleas<br>Is there anything I can do<br>'Cause I really can't stand it, I'm so in love with you<br><br>Tell me why you cried<br>And why you lied to me<br>Tell me why you cried<br>And why you lied to me"
Thank You Girl,4,"Oh, oh, you've been good to me<br>You made me glad<br>When I was blue<br>And eternally I'll always be<br>In love with you<br>And all I gotta do<br>Is thank you girl, thank you girl<br><br>I could tell the world<br>A thing or two about our love<br>I know little girl<br>Only a fool would doubt our love<br>And all I gotta do<br>Is thank you girl, thank you girl<br><br>Thank you girl for loving me<br>The way that you do (Way that you do)<br>That's the kind of love<br>That is too good to be true<br>And all I gotta do<br>Is thank you girl, thank you girl<br><br>Oh, oh, you've been good to me<br>You made me glad<br>When I was blue<br>And eternally I'll always be<br>In love with you<br>And all I gotta do<br>Is thank you girl, thank you girl<br><br>Oh, oh, oh<br>Oh, oh, oh<br>Oh, oh"
The Ballad Of John And Yoko,1,"Standing in the dock at Southampton<br>Trying to get to Holland or France<br>The man in the mac said, You've got to go back<br>You know they didn't even give us a chance<br><br>Christ you know it ain't easy<br>You know how hard it can be<br>The way things are going<br>They're going to crucify me<br><br>Finally made the plane into Paris<br>Honeymooning down by the Seine<br>Peter Brown called to say<br>You can make it OK<br>You can get married in Gibraltar, near Spain<br><br>Christ you know it ain't easy<br>You know how hard it can be<br>The way things are going<br>They're going to crucify me<br><br>Drove from Paris to the Amsterdam Hilton<br>Talking in our beds for a week<br>The newspapers said, Say what you doing in bed?<br>I said, We're only trying to get us some peace<br><br>Christ you know it ain't easy<br>You know how hard it can be<br>The way things are going<br>They're going to crucify me<br><br>Saving up your money for a rainy day<br>Giving all your clothes to charity<br>Last night the wife said<br>Poor boy, when you're dead<br>You don't take nothing with you<br>But your soul, think!<br><br>Made a lightning trip to Vienna<br>Eating chocolate cake in a bag<br>The newspapers said, She's gone to his head<br>They look just like two gurus in drag<br><br>Christ you know it ain't easy<br>You know how hard it can be<br>The way things are going<br>They're going to crucify me<br><br>Caught an early plane back to London<br>Fifty acorns tied in a sack<br>The men from the press said, We wish you success<br>It's good to have the both of you back<br><br>Christ you know it ain't easy<br>You know how hard it can be<br>The way things are going<br>They're going to crucify me<br>The way things are going<br>They're going to crucify me"
The Continuing Story Of Bungalow Bill,4,"Hey, Bungalow Bill<br>What did you kill, Bungalow Bill?<br>Hey, Bungalow Bill<br>What did you kill, Bungalow Bill?<br><br>He went out tiger hunting with his elephant and gun<br>In case of accidents he always took his mum<br>He's the all American bullet-headed Saxon mother's son<br>All the children sing<br><br>Hey, Bungalow Bill<br>What did you kill, Bungalow Bill?<br>Hey, Bungalow Bill<br>What did you kill, Bungalow Bill?<br><br>Deep in the jungle where the mighty tiger lies<br>Bill and his elephants were taken by surprise<br>So Captain Marvel zapped him right between the eyes, zap!<br>All the children sing<br><br>Hey, Bungalow Bill<br>What did you kill, Bungalow Bill?<br>Hey, Bungalow Bill<br>What did you kill, Bungalow Bill?<br><br>The children asked him if to kill was not a sin<br>""Not when he looked so fierce"", his mummy butted in<br>If looks could kill it would have been us instead of him<br>All the children sing<br><br>Hey, Bungalow Bill<br>What did you kill, Bungalow Bill?<br>Hey, Bungalow Bill<br>What did you kill, Bungalow Bill?<br><br>Oh ho!<br><br>Hey, Bungalow Bill<br>What did you kill, Bungalow Bill?<br>Hey, Bungalow Bill<br>What did you kill, Bungalow Bill?<br><br>Hey, Bungalow Bill<br>What did you kill, Bungalow Bill?<br>Hey, Bungalow Bill<br>What did you kill, Bungalow Bill?<br><br>Hey, Bungalow Bill<br>What did you kill, Bungalow Bill?<br>Hey, Bungalow Bill<br>What did you kill, Bungalow Bill?<br><br>Ey op!"
The End,4,"Oh yeah, all right<br>Are you going to be in my dreams<br>Tonight?<br><br>And in the end<br>The love you take<br>Is equal to the love<br>You make"
