song,level,lyrics
Free As A Bird,4,"Free as a bird<br>It's the next best thing to be<br>Free as a bird<br><br>Home, home and dry<br>Like a homing bird I'll fly<br>As a bird on wings<br><br>Whatever happened to<br>The life that we once knew?<br>Can we really live without each other?<br><br>Where did we lose the touch<br>That seemed to mean so much?<br>It always made me feel so...<br><br>Free as a bird<br>Like the next best thing to be<br>Free as a bird<br><br>Home, home and dry<br>Like a homing bird I'll fly<br>As a bird on wings<br><br>Whatever happened to<br>The life that we once knew?<br>Always made me feel so free<br><br>Ah...<br>Ah...<br>Ah...<br><br>Free as a bird<br>It's the next best thing to be<br>Free as a bird<br>Free as a bird<br>Free as a bird<br>Oooooo<br><br>Free..."
From Me To You,1,"Da da da da da dum dum da<br>Da da da da da dum dum da<br><br>If there's anything that you want<br>If there's anything I can do<br>Just call on me and I'll send it along<br>With love from me to you<br><br>I've got everything that you want<br>Like a heart that's oh so true<br>Just call on me and I'll send it along<br>With love from me to you<br><br>I got arms that long to hold you<br>And keep you by my side<br>I got lips that long to kiss you<br>And keep you satisfied, oooh<br><br>If there's anything that you want<br>If there's anything I can do<br>Just call on me and I'll send it along<br>With love from me to you<br><br>From me, to you<br>Just call on me and I'll send it along<br>With love from me to you<br><br>I got arms that long to hold you<br>And keep you by my side<br>I got lips that long to kiss you<br>And keep you satisfied, oooh<br><br>If there's anything that you want<br>If there's anything I can do<br>Just call on me and I'll send it along<br>With love from me to you<br>To you, to you, to you"
Get Back,1,"Jo Jo was a man who thought he was a loner<br>But he knew it couldn't last<br>Jo Jo left his home in Tucson, Arizona<br>For some California grass<br><br>Get back, get back<br>Get back to where you once belonged<br>Get back, get back<br>Get back to where you once belonged<br>Get back Jo Jo<br>Go home<br><br>Get back, get back<br>Get back to where you once belonged<br>Get back, get back<br>Back to where you once belonged<br>Get back, Jo<br><br>Sweet Loretta Martin thought she was a woman<br>But she was another man<br>All the girls around her say she's got it coming<br>But she gets it while she can<br><br>Oh, get back, get back<br>Get back to where you once belonged<br>Get back, get back<br>Get back to where you once belonged<br>Get back, Loretta<br><br>Go home<br>Oh, get back, get back<br>Get back to where you once belonged<br>Get back, get back<br>Get back to where you once belonged<br><br>Ooh, ooh, get back, Loretta<br>Your mommy's waiting for you<br>Wearing her high-heel shoes<br>And her low-neck sweater<br>Get back home, Loretta<br><br>Get back, get back, get back to where you once belonged<br>Oh, get back, get back<br>Get back, oh, yes<br>Jo Jo"
Getting Better,4,"It's getting better all the time<br><br>I used to get mad at my school (No I can't complain)<br>The teachers who taught me weren't cool (No I can't complain)<br>You're holding me down (Oh), turning me round (Oh)<br>Filling me up with your rules (Foolish rules)<br><br>I've got to admit it's getting better (Better)<br>A little better all the time (It can't get no worse)<br>I have to admit it's getting better (Better)<br>It's getting better since you've been mine<br><br>Me used to be angry young man<br>Me hiding me head in the sand<br>You gave me the word, I finally heard<br>I'm doing the best that I can<br><br>I've got to admit it's getting better (Better)<br>A little better all the time (It can't get no worse)<br>I have to admit it's getting better (Better)<br>It's getting better since you've been mine<br>Getting so much better all the time<br>It's getting better all the time<br>Better, better, better<br>It's getting better all the time<br>Better, better, better<br><br>I used to be cruel to my woman<br>I beat her and kept her apart from the things that she loved<br>Man I was mean but I'm changing my scene<br>And I'm doing the best that I can (Ooh)<br><br>I admit it's getting better (Better)<br>A little better all the time (It can't get no worse)<br>Yes I admit it's getting better (Better)<br>It's getting better since you've been mine<br>Getting so much better all the time<br>It's getting better all the time<br>Better, better, better<br>It's getting better all the time<br>Better, better, better<br>Getting so much better all the time"
Girl,2,"Is there anybody going to listen to my story<br>All about the girl who came to stay?<br>She's the kind of girl you want so much it makes you sorry<br>Still, you don't regret a single day<br><br>Ah, girl, girl, girl<br><br>When I think of all the times I tried so hard to leave her<br>She will turn to me and start to cry<br>And she promises the earth to me and I believe her<br>After all this time I don't know why<br><br>Ah, girl, girl, girl<br><br>She's the kind of girl who puts you down<br>When friends are there,<br>You feel a fool<br>When you say she's looking good<br>She acts as if it's understood.<br>She's cool, ooh, ooh, ooh<br><br>Ah, girl, girl, girl<br><br>Was she told when she was young that pain would lead to pleasure?<br>Did she understand it when they said<br>That a man must break his back to earn his day of leisure?<br>Will she still believe it when he's dead?<br><br>Ah, girl, girl, girl"
Glass Onion,3,"I told you about strawberry fields<br>You know the place where nothing is real<br>Well here's another place you can go<br>Where everything flows<br>Looking through the bent backed tulips<br>To see how the other half live<br>Looking through a glass onion<br><br>I told you about the walrus and me, man<br>You know that we're as close as can be, man<br>Well here's another clue for you all<br>The walrus was Paul<br>Standing on the cast iron shore, yeah<br>Lady Madonna trying to make ends meet, yeah<br>Looking through a glass onion<br><br>Oh yeah<br>Oh yeah<br>Oh yeah<br>Looking through a glass onion<br><br>I told you about the fool on the hill<br>I tell you man he living there still<br>Well here's another place you can be<br>Listen to me<br>Fixing a hole in the ocean<br>Trying to make a dove-tail joint, yeah<br>Looking through a glass onion"
Golden Slumbers,4,"Once, there was a way to get back homeward<br>Once, there was a way to get back home<br>Sleep, pretty darling, do not cry<br>And I will sing a lullaby<br><br>Golden slumbers fill your eyes<br>Smiles awake you when you rise<br>Sleep, pretty darling, do not cry<br>And I will sing a lullaby<br><br>Once, there was a way to get back homeward<br>Once, there was a way to get back home<br>Sleep, pretty darling, do not cry<br>And I will sing a lullaby"
Good Day Sunshine,4,"Good day sunshine, good day sunshine, good day sunshine<br><br>I need to laugh and when the sun is out<br>I've got something I can laugh about<br>I feel good in a special way<br>I'm in love and it's a sunny day<br><br>Good day sunshine, good day sunshine, good day sunshine<br><br>We take a walk, the sun is shining down<br>Burns my feet as they touch the ground<br><br>Good day sunshine, good day sunshine, good day sunshine<br><br>Then we'd lie beneath the shady tree<br>I love her and she's loving me<br>She feels good, she knows she's looking fine<br>I'm so proud to know that she is mine.<br><br>Good day sunshine, good day sunshine, good day sunshine<br>Good day sunshine, good day sunshine, good day sunshine<br>Good day sunshine, good day sunshine, good day sunshine<br>Good day..."
Good Morning Good Morning,4,"Good morning, good morning<br>Good morning, good morning<br>Good morning ah<br><br>Nothing to do to save his life call his wife in<br>Nothing to say but what a day how's your boy been<br>Nothing to do it's up to you<br>I've got nothing to say but it's OK<br><br>Good morning, good morning<br>Good morning ah<br><br>Going to work don't want to go feeling low down<br>Heading for home you start to roam then you're in town<br>Everybody knows there's nothing doing<br>Everything is closed it's like a ruin<br>Everyone you see is half asleep<br>And you're on your own you're in the street<br><br>After a while you start to smile now you feel cool<br>Then you decide to take a walk by the old school<br>Nothing is changed it's still the same<br>I've got nothing to say but it's OK<br><br>Good morning, good morning<br>Good morning ah<br><br>People running round it's five o'clock<br>Everywhere in town is getting dark<br>Everyone you see is full of life<br>It's time for tea and meet the wife<br><br>Somebody needs to know the time, glad that I'm here<br>Watching the skirts you start to flirt now you're in gear<br>Go to a show you hope she goes<br>I've got nothing to say but it's OK<br><br>Good morning, good morning, good<br>Good morning, good morning, good<br>Good morning, good morning, good<br>Good morning, good morning, good<br>Good morning, good morning, good<br>Good morning, good morning, good<br>Good morning, good morning, good<br>Good morning, good morning, good<br>Good morning, good morning, good<br>Good morning, good morning, good"
Good Night,4,"Now it's time to say good night<br>Good night, sleep tight<br>Now the sun turns out his light<br>Good night, sleep tight<br>Dream sweet dreams for me (Dream sweet)<br>Dream sweet dreams for you<br><br>Close your eyes and I'll close mine<br>Good night, sleep tight<br>Now the moon begins to shine<br>Good night, sleep tight<br>Dream sweet dreams for me (Dream sweet)<br>Dream sweet dreams for you<br><br>Mmmmmm<br>Mmmmmm<br>Mmmmmmmmmm<br><br>Close your eyes and I'll close mine<br>Good night, sleep tight<br>Now the sun turns out his light<br>Good night, sleep tight<br>Dream sweet dreams for me (Dream sweet)<br>Dream sweet dreams for you<br><br>Good night, good night, everybody<br>Everybody everywhere<br>Good night"
Got To Get You Into My Life,3,"I was alone, I took a ride<br>I didn't know what I would find there<br>Another road where maybe I could see another kind of mind there<br><br>Ooh, then I suddenly see you<br>Ooh, did I tell you I need you<br>Every single day of my life<br><br>You didn't run, you didn't lie<br>You knew I wanted just to hold you<br>And had you gone you knew in time we'd meet again<br>For I had told you<br><br>Ooh, you were meant to be near me<br>Ooh, and I want you to hear me<br>Say we'll be together every day<br><br>Got to get you into my life<br><br>What can I do, what can I be<br>When I'm with you I want to stay there<br>If I'm true I'll never leave<br>And if I do I know the way there<br><br>Ooh, then I suddenly see you<br>Ooh, did I tell you I need you<br>Every single day of my life<br><br>Got to get you into my life<br>Got to get you into my life<br><br>I was alone, I took a ride<br>I didn't know what I would find there<br>Another road where maybe I could see another kind of mind there<br><br>Then suddenly I see you<br>Did I tell you I need you<br>Every single day?"
Happiness Is A Warm Gun,4,"She's not a girl who misses much<br>Do do do do do do do do, oh yeah<br>She's well acquainted with the touch of the velvet hand<br>Like a lizard on a window pane<br>The man in the crowd with the multicoloured mirrors<br>On his hobnail boots<br>Lying with his eyes while his hands are busy<br>Working overtime<br>A soap impression of his wife which he ate<br>And donated to the National Trust<br><br>Down<br>I need a fix 'cause I'm going down<br>Down to the bits that I left uptown<br>I need a fix 'cause I'm going down<br><br>Mother Superior jump the gun<br>Mother Superior jump the gun<br>Mother Superior jump the gun<br>Mother Superior jump the gun<br>Mother Superior jump the gun<br>Mother Superior jump the gun<br><br>Happiness is a warm gun (Happiness bang, bang, shoot, shoot)<br>Happiness is a warm gun, mama (Happiness bang, bang, shoot, shoot)<br>When I hold you in my arms (Oo-oo oh yeah)<br>And I feel my finger on your trigger (Oo-oo oh yeah)<br>I know nobody can do me no harm (Oo-oo oh yeah)<br><br>Because happiness is a warm gun, mama (Happiness bang, bang, shoot, shoot)<br>Happiness is a warm gun, yes it is (Happiness bang, bang, shoot, shoot)<br>Happiness is a warm, yes it is, gun (Happiness bang, bang, shoot, shoot)<br>Well, don't you know that happiness is a warm gun, mama? (Happiness is a warm gun, yeah)"
"Hello, Goodbye",1,"You say yes, I say no<br>You say stop and I say go go go, oh no<br>You say goodbye and I say hello<br>Hello hello<br>I don't know why you say goodbye, I say hello<br>Hello hello<br>I don't know why you say goodbye, I say hello<br><br>I say high, you say low<br>You say why and I say I don't know, oh no<br>You say goodbye and I say hello<br>(Hello goodbye hello goodbye) Hello hello<br>(Hello goodbye) I don't know why you say goodbye, I say hello<br>(Hello goodbye hello goodbye) Hello hello<br>(Hello goodbye) I don't know why you say goodbye<br>(Hello goodbye) I say hello/goodbye<br><br>Why why why why why why do you say goodbye goodbye, oh no?<br><br>You say goodbye and I say hello<br>Hello hello<br>I don't know why you say goodbye, I say hello<br>Hello hello<br>I don't know why you say goodbye, I say hello<br><br>You say yes (I say yes) I say no (But I may mean no)<br>You say stop (I can stay) and I say go go go (Till it's time to go), oh<br>Oh no<br>You say goodbye and I say hello<br>Hello hello<br>I don't know why you say goodbye, I say hello<br>Hello hello<br>I don't know why you say goodbye, I say hello<br>Hello hello<br>I don't know why you say goodbye, I say hello hello<br><br>Hela heba helloa<br>Hela heba helloa, cha cha cha<br>Hela heba helloa, wooo<br>Hela heba helloa, hela<br>Hela heba helloa, cha cha cha<br>Hela heba helloa, wooo<br>Hela heba helloa, cha cah cah"
Help!,1,"Help! I need somebody<br>Help! Not just anybody<br>Help! You know I need someone<br>Help!<br><br>(When) When I was younger (When I was young) so much younger than today<br>(I never need) I never needed anybody's help in any way<br>(Now) But now these days are gone (These days are gone) and I'm not so self assured<br>(And now I find) Now I find I've changed my mind, I've opened up the doors<br><br>Help me if you can, I'm feeling down<br>And I do appreciate you being 'round<br>Help me get my feet back on the ground<br>Won't you please, please help me?<br><br>(Now) And now my life has changed (My life has changed) in oh so many ways<br>(My independence) My independence seems to vanish in the haze<br>(But) But ev'ry now (Every now and then) and then I feel so insecure<br>(I know that I) I know that I just need you like I've never done before<br><br>Help me if you can, I'm feeling down<br>And I do appreciate you being 'round<br>Help me get my feet back on the ground<br>Won't you please, please help me?<br><br>When I was younger, so much younger than today<br>I never needed anybody's help in any way<br>(Now) But now these days are gone (These days are gone) and I'm not so self assured<br>(And now I find) Now I find I've changed my mind, I've opened up the doors<br><br>Help me if you can, I'm feeling down<br>And I do appreciate you being 'round<br>Help me get my feet back on the ground<br>Won't you please, please help me?<br><br>Help me, help me<br>Ooh"
Helter Skelter,4,"When I get to the bottom I go back to the top of the slide<br>Where I stop and I turn and I go for a ride<br>Till I get to the bottom and I see you again<br>Yeah yeah yeah hey<br><br>Do you, don't you want me to love you<br>I'm coming down fast but I'm miles above you<br>Tell me tell me tell me come on tell me the answer<br>Well you may be a lover but you ain't no dancer<br><br>Now helter skelter helter skelter<br>Helter skelter yeah<br>Ooh!<br><br>Will you, won't you want me to make you<br>I'm coming down fast but don't let me break you<br>Tell me tell me tell me the answer<br>You may be a lover but you ain't no dancer<br><br>Look out helter skelter helter skelter<br>Helter skelter ooh<br><br>Look out, cos here she comes<br><br>When I get to the bottom I go back to the top of the slide<br>And I stop and I turn and I go for a ride<br>And I get to the bottom and I see you again<br>Yeah yeah yeah<br><br>Well do you, don't you want me to make you<br>I'm coming down fast but don't let me break you<br>Tell me tell me tell me the answer<br>You may be a lover but you ain't no dancer<br><br>Look out helter skelter helter skelter<br>Helter skelter<br><br>Look out helter skelter<br>She's coming down fast<br>Yes she is<br>Yes she is coming down fast<br><br>(My head is spinning, ooh...)<br><br>(Ha ha ha, ha ha ha, alright!)<br><br>(I got blisters on my fingers!)"
Her Majesty,4,"Her Majesty's a pretty nice girl<br>But she doesn't have a lot to say<br>Her Majesty's a pretty nice girl<br>But she changes from day to day<br><br>I wanna tell her that I love her a lot<br>But I gotta get a belly full of wine<br>Her Majesty's a pretty nice girl<br>Someday I'm gonna make her mine, oh yeah<br>Someday I'm gonna make her mine"
Here Comes The Sun,2,"Here comes the sun, doo-doo-doo-doo, here comes the sun<br>And I say it's all right<br><br>Little darling, it's been a long cold lonely winter<br>Little darling, it feels like years since it's been here<br><br>Here comes the sun, doo-doo-doo-doo, here comes the sun<br>And I say it's all right<br><br>Little darling, the smiles returning to the faces<br>Little darling, it seems like years since it's been here<br><br>Here comes the sun, doo-doo-doo-doo, here comes the sun<br>And I say it's all right<br><br>Sun, sun, sun, here it comes<br>Sun, sun, sun, here it comes<br>Sun, sun, sun, here it comes<br>Sun, sun, sun, here it comes<br>Sun, sun, sun, here it comes<br><br>Little darling, I feel that ice is slowly melting<br>Little darling, it seems like years since it's been clear<br><br>Here comes the sun, doo-doo-doo-doo, here comes the sun<br>And I say it's all right<br><br>Here comes the sun, doo-doo-doo-doo, here comes the sun<br>It's all right<br>It's all right"
"Here, There And Everywhere",3,"To lead a better life I need my love to be here...<br><br>Here, making each day of the year<br>Changing my life with the wave of her hand<br>Nobody can deny that there's something there<br><br>There, running my hands through her hair<br>Both of us thinking how good it can be<br>Someone is speaking but she doesn't know he's there<br><br>I want her everywhere and if she's beside me<br>I know I need never care<br>But to love her is to need her everywhere<br>Knowing that love is to share<br><br>Each one believing that love never dies<br>Watching her eyes and hoping I'm always there<br><br>I want her everywhere and if she's beside me<br>I know I need never care<br>But to love her is to need her everywhere<br>Knowing that love is to share<br><br>Each one believing that love never dies<br>Watching her eyes and hoping I'm always there<br><br>I will be there and everywhere<br>Here, there and everywhere"
Hey Bulldog,3,"Sheepdog<br>Standing in the rain<br>Bullfrog<br>Doing it again<br>Some kind of happiness is measured out in miles<br>What makes you think you're something special when you smile?<br><br>Child-like<br>No one understands<br>Jack knife<br>In your sweaty hands<br>Some kind of innocence is measured out in years<br>You don't know what it's like to listen to your fears<br><br>You can talk to me<br>You can talk to me<br>You can talk to me, if you're lonely you can talk to me<br><br>Yeah hey, oh!<br>Ho, ho!<br>Yeah!<br>Ho, ho, ho, ho!<br>Ho, ho!<br><br>Big man (Yeah)<br>Walking in the park<br>Wigwam<br>Frightened of the dark<br>Some kind of solitude is measured out in you<br>You think you know me but you haven't got a clue<br><br>You can talk to me<br>You can talk to me<br>You can talk to me, if you're lonely you can talk to me<br>Hey!<br><br>Wahoo woof! Woof!<br><br>Hey bulldog! Hey bulldog!<br>Hey bulldog! Hey bulldog!<br><br>[Hey man, what's that noise?<br><br>Woof!<br><br>What d'you say?<br><br>I said woof!<br><br>D'you know anymore?<br><br>Wooaah ha ha ha!<br><br>You've got it, that's great! That's right! That's it, man, hoo!<br><br>Give it to me, man, hurry! I've got ten children, ho!<br><br>Ah ho! Ha ha ha ha ha ha!<br><br>Quiet boy, quiet!<br><br>OK.]<br><br>Hey bulldog!<br>Hey bulldog!"
Hey Jude,1,"Hey, Jude, don't make it bad<br>Take a sad song and make it better<br>Remember to let her into your heart<br>Then you can start to make it better<br><br>Hey, Jude, don't be afraid<br>You were made to go out and get her<br>The minute you let her under your skin<br>Then you begin to make it better<br><br>And anytime you feel the pain,<br>Hey, Jude, refrain<br>Don't carry the world upon your shoulders<br>For well you know that it's a fool<br>Who plays it cool<br>By making his world a little colder<br><br>Nah, nah nah, nah nah, nah nah, nah nah<br><br>Hey, Jude, don't let me down<br>You have found her, now go and get her<br>Remember to let her into your heart<br>Then you can start to make it better<br><br>So let it out and let it in,<br>Hey, Jude, begin<br>You're waiting for someone to perform with<br>And don't you know that it's just you,<br>Hey, Jude, you'll do<br>The movement you need is on your shoulder<br><br>Nah, nah nah, nah nah, nah nah, nah nah yeah<br><br>Hey, Jude, don't make it bad<br>Take a sad song and make it better<br>Remember to let her under your skin<br>Then you'll begin to make it better, better, better, better, better... oh!<br><br>Nah, nah nah, nah nah, nah, nah, nah nah,<br>Hey, Jude<br>Nah, nah nah, nah nah, nah, nah, nah nah,<br>Hey, Jude<br>Nah, nah nah, nah nah, nah, nah, nah nah,<br>Hey, Jude (Jude)<br>Nah, nah nah, nah nah, nah, nah, nah nah,<br>Hey, Jude (yeah, yeah, yeah)<br>Nah, nah nah, nah nah, nah, nah, nah nah,<br>Hey, Jude<br>Nah, nah nah, nah nah, nah, nah, nah nah,<br>Hey, Jude (don't make it bad, Jude)<br>Nah, nah nah, nah nah, nah, nah, nah nah,<br>Hey, Jude (take a sad song and make it better)<br>Nah, nah nah, nah nah, nah, nah, nah nah,<br>Hey, Jude (oh, Jude)<br>Nah, nah nah, nah nah, nah, nah, nah nah,<br>Hey, Jude (Jude, hey, Jude, whoa)<br>Nah, nah nah, nah nah, nah, nah, nah nah,<br>Hey, Jude<br>Nah, nah nah, nah nah, nah, nah, nah nah,<br>Hey, Jude (ooh)<br>Nah, nah nah, nah nah, nah, nah, nah nah,<br>Hey, Jude<br>Nah, nah nah, nah nah, nah, nah, nah nah,<br>Hey, Jude<br>Nah, nah nah, nah nah, nah, nah, nah nah,<br>Hey, Jude<br>Nah, nah nah, nah nah, nah, nah, nah nah,<br>Hey, Jude<br>Nah, nah nah, nah nah, nah, nah, nah nah,<br>Hey, Jude"
Hold Me Tight,4,"It feels so right now, hold me tight<br>Tell me I'm the only one<br>And then I might<br>Never be the lonely one<br>So hold me tight, tonight, tonight,<br>It's you, you you you oooo oooo<br><br>Hold me tight<br>Let me go on loving you<br>Tonight tonight<br>Making love to only you<br>So hold me tight, tonight, tonight<br>It's you, you you you oooo oooo<br><br>Don't know what it means to hold you tight<br>Being here alone tonight with you<br>It feels so right now, feels so right now<br><br>Hold me tight<br>Tell me I'm the only one<br>And then I might<br>Never be the lonely one<br>So hold me tight, tonight, tonight<br>It's you, you you you oooo oooo<br><br>Don't know what it means to hold you tight<br>Being here alone tonight with you<br>It feels so right now, feels so right now<br><br>Hold me tight<br>Let me go on loving you<br>Tonight, tonight<br>Making love to only you<br>So hold me tight, tonight, tonight<br>It's you, you you you oooo oooo<br>You oooo"
Honey Don't,4,"Well how come you say you will when you won't<br>Say you do, baby, when you don't?<br>Let me know honey how you feel<br>Tell the truth now, is love real?<br>But ah ah well honey don't, well honey don't<br>Honey don't, honey don't, honey don't<br>I say you will when you won't, ah ah, honey, don't<br><br>Well I love you, baby, and you ought to know<br>I like the way you wear your clothes<br>Everything about you is so doggone sweet<br>You got that sand all over your feet<br>But ah ah well honey don't, honey don't<br>Honey don't, honey don't, honey don't<br>I say you will when you won't, ah ah, honey, don't<br><br>[Ah, rock on George, one time for me.<br><br>I feel fine.<br>I said.]<br><br>Well sometimes I love you on a Saturday night<br>Sunday morning you don't look right<br>You've been out painting the town<br>Ah ah baby, been stepping around<br>But ah ah well honey don't, I said honey don't<br>Honey don't, honey don't, honey don't<br>I say you will when you won't, ah ah, honey, don't<br><br>[Ah, rock on George, for Ringo one time.]<br>Well honey don't, well honey don't<br>I say you will when you won't, ah ah, honey, don't"
Honey Pie,4,"She was a working girl<br>North of England way<br>Now she's hit the big time<br>In the USA<br>And if she could only hear me<br>This is what I'd say<br><br>Honey pie you are making me crazy<br>I'm in love but I'm lazy<br>So won't you please come home<br><br>Oh honey pie my position is tragic<br>Come and show me the magic<br>Of your Hollywood song<br><br>You became a legend of the silver screen<br>And now the thought of meeting you<br>Makes me weak in the knee<br><br>Oh honey pie you are driving me frantic<br>Sail across the Atlantic<br>To be where you belong<br><br>Honey pie come back to me, oh<br><br>Yeah<br>I like it like that, oh ah<br>I like this kind of hot kind of music<br>Hot kind of music<br>Play it to me, play it to me, honey, the blues<br><br>Will the wind that blew her boat<br>Across the sea<br>Kindly send her sailing back to me<br><br>Honey pie you are making me crazy<br>I'm in love but I'm lazy<br>So won't you please come home<br>Come, come back to me, honey pie<br><br>Oooooooooooh oh<br>Oh oh oh oh oh oh oh<br>Honey pie, honey pie"
